{
  "$schema": "https://opennoodl.dev/schemas/project-v2.json",
  "name": "Panel Desk",
  "id": "c0a1b2c3-0000-4000-8000-000000000060",
  "version": "4",
  "nodegxVersion": "0.2.0",
  "runtimeVersion": "react19",
  "created": "2026-09-05T09:00:00.000Z",
  "modified": "2026-09-05T09:00:00.000Z",
  "settings": {
    "htmlTitle": "Panel Desk",
    "navigationPathType": "path"
  },
  "structure": {
    "componentsDir": "components"
  }
}
